{
  "description": "Dyninstruments Motorboat — helm (compass/speed), route detail, systems monitoring",
  "layoutVersion": 1,
  "properties": {
    "layers": {
      "ais": true
    }
  },
  "widgets": {
    "navpage": {
      "left": [
        {
          "name": "dyni_Nav_Instruments",
          "kind": "activeRoute",
          "formatUnit_activeRouteRemain": "nm",
          "unit_activeRouteRemain_nm": "nm",
          "unit_activeRouteNextCourse": "°"
        },
        {
          "name": "dyni_Nav_Instruments",
          "kind": "xteDisplay",
          "formatUnit_xteDisplayXte": "nm",
          "unit_xteDisplayXte_nm": "nm",
          "unit_xteDisplayCog": "°",
          "formatUnit_xteDisplayDst": "nm",
          "unit_xteDisplayDst_nm": "nm",
          "unit_xteDisplayBrg": "°",
          "leadingZero": true,
          "xteHideTextualMetrics": true
        },
        {
          "name": "dyni_Environment_Instruments",
          "kind": "depth"
        },
        {
          "name": "dyni_Map_Instruments",
          "kind": "aisTarget",
          "formatUnit_aisTargetDst": "nm",
          "formatUnit_aisTargetCpa": "nm",
          "unit_aisTargetTcpa": "min",
          "unit_aisTargetBrg": "°"
        },
        {
          "name": "dyni_Vessel_Instruments",
          "kind": "voltage"
        }
      ],
      "bottomLeft": [
        {
          "kind": "brg",
          "name": "dyni_CourseHeading_Instruments"
        },
        {
          "name": "dyni_Nav_Instruments",
          "kind": "dst",
          "formatUnit_dst": "nm",
          "unit_dst_nm": "nm"
        },
        {
          "name": "dyni_Speed_Instruments",
          "kind": "sog"
        }
      ],
      "bottomRight": [
        {
          "name": "dyni_CourseHeading_Instruments",
          "kind": "cog",
          "leadingZero": true
        },
        {
          "name": "dyni_Vessel_Instruments",
          "kind": "timeStatus"
        },
        {
          "name": "dyni_Nav_Instruments",
          "kind": "positionBoat"
        }
      ],
      "left_small": [],
      "top_small": [
        {
          "name": "dyni_Environment_Instruments",
          "kind": "depth"
        }
      ],
      "bottomLeft_small": [
        {
          "name": "dyni_CourseHeading_Instruments",
          "kind": "brg",
          "leadingZero": true
        },
        {
          "name": "dyni_Speed_Instruments",
          "kind": "sog"
        }
      ],
      "bottomRight_small": [
        {
          "name": "dyni_CourseHeading_Instruments",
          "kind": "cog",
          "leadingZero": true
        },
        {
          "name": "dyni_Vessel_Instruments",
          "kind": "timeStatus"
        }
      ],
      "left_anchor": [
        {
          "name": "dyni_Anchor_Instruments",
          "kind": "anchorBearing",
          "leadingZero": true
        },
        {
          "name": "dyni_Anchor_Instruments",
          "kind": "anchorDistance",
          "formatUnit_anchorDistance": "m",
          "unit_anchorDistance_m": "m"
        },
        {
          "name": "dyni_Anchor_Instruments",
          "kind": "anchorWatch",
          "formatUnit_anchorWatch": "m",
          "unit_anchorWatch_m": "m"
        },
        {
          "name": "dyni_Environment_Instruments"
        },
        {
          "name": "dyni_Speed_Instruments"
        }
      ],
      "bottomLeft_anchor": [
        {
          "name": "dyni_Environment_Instruments",
          "kind": "temp"
        },
        {
          "name": "dyni_Environment_Instruments",
          "kind": "pressure"
        }
      ],
      "bottomRight_anchor": [
        {
          "name": "dyni_Vessel_Instruments"
        },
        {
          "kind": "timeStatus",
          "name": "dyni_Vessel_Instruments"
        }
      ],
      "left_small_anchor": [],
      "top_small_anchor": [
        {
          "name": "dyni_Environment_Instruments"
        }
      ],
      "bottomLeft_small_anchor": [
        {
          "name": "dyni_Anchor_Instruments",
          "kind": "anchorBearing",
          "leadingZero": true
        },
        {
          "name": "dyni_Anchor_Instruments",
          "kind": "anchorDistance",
          "formatUnit_anchorDistance": "m",
          "unit_anchorDistance_m": "m"
        }
      ],
      "bottomRight_small_anchor": [
        {
          "kind": "anchorWatch",
          "name": "dyni_Anchor_Instruments"
        },
        {
          "name": "dyni_Vessel_Instruments",
          "kind": "timeStatus"
        }
      ]
    },
    "gpspage1": {
      "left": [
        {
          "kind": "hdtLinear",
          "compassLinearTickMajor": 45,
          "compassLinearTickMinor": 15,
          "compassLinearShowEndLabels": true,
          "name": "dyni_CourseHeading_Instruments",
          "weight": 2
        },
        {
          "name": "dyni_CourseHeading_Instruments"
        },
        {
          "name": "dyni_CourseHeading_Instruments",
          "kind": "brg",
          "leadingZero": true
        }
      ],
      "m1": [
        {
          "kind": "sogRadial",
          "speedRadialShowEndLabels": true,
          "speedRadialWarningFrom_kn": 25,
          "speedRadialAlarmFrom_kn": 28,
          "name": "dyni_Speed_Instruments",
          "weight": 1
        },
        {
          "name": "dyni_Vessel_Instruments",
          "kind": "voltage"
        }
      ],
      "right": [
        {
          "kind": "depthLinear",
          "name": "dyni_Environment_Instruments",
          "weight": 1
        },
        {
          "name": "dyni_Nav_Instruments",
          "kind": "positionBoat"
        },
        {
          "name": "dyni_Map_Instruments",
          "kind": "aisTarget",
          "formatUnit_aisTargetDst": "nm",
          "formatUnit_aisTargetCpa": "nm",
          "unit_aisTargetTcpa": "min",
          "unit_aisTargetBrg": "°"
        }
      ],
      "left_anchor": [
        {
          "name": "dyni_Anchor_Instruments",
          "kind": "anchorBearing",
          "leadingZero": true
        },
        {
          "name": "dyni_Anchor_Instruments",
          "kind": "anchorDistance",
          "formatUnit_anchorDistance": "m",
          "unit_anchorDistance_m": "m"
        },
        {
          "name": "dyni_Anchor_Instruments",
          "kind": "anchorWatch",
          "formatUnit_anchorWatch": "m",
          "unit_anchorWatch_m": "m"
        },
        {
          "name": "dyni_Environment_Instruments",
          "kind": "depth"
        },
        {
          "name": "dyni_Vessel_Instruments",
          "kind": "voltage"
        }
      ]
    },
    "gpspage2": {
      "left": [
        {
          "name": "dyni_Nav_Instruments",
          "kind": "xteDisplay",
          "formatUnit_xteDisplayXte": "nm",
          "unit_xteDisplayXte_nm": "nm",
          "unit_xteDisplayCog": "°",
          "formatUnit_xteDisplayDst": "nm",
          "unit_xteDisplayDst_nm": "nm",
          "unit_xteDisplayBrg": "°",
          "leadingZero": true
        },
        {
          "name": "dyni_Speed_Instruments",
          "kind": "sog"
        }
      ],
      "m1": [
        {
          "kind": "timeStatus",
          "name": "dyni_Vessel_Instruments",
          "weight": 1
        },
        {
          "kind": "routePoints",
          "showHeader": false,
          "name": "dyni_Nav_Instruments",
          "weight": 2
        }
      ],
      "right": [
        {
          "name": "dyni_Nav_Instruments",
          "kind": "wpEta"
        },
        {
          "name": "dyni_Nav_Instruments",
          "kind": "rteEta"
        },
        {
          "name": "dyni_Nav_Instruments",
          "kind": "rteDistance",
          "formatUnit_rteDistance": "nm",
          "unit_rteDistance_nm": "nm"
        }
      ],
      "left_anchor": [
        {
          "name": "dyni_Anchor_Instruments",
          "kind": "anchorBearing",
          "leadingZero": true
        },
        {
          "name": "dyni_Anchor_Instruments",
          "kind": "anchorDistance",
          "formatUnit_anchorDistance": "m",
          "unit_anchorDistance_m": "m"
        },
        {
          "name": "dyni_Anchor_Instruments",
          "kind": "anchorWatch",
          "formatUnit_anchorWatch": "m",
          "unit_anchorWatch_m": "m"
        },
        {
          "name": "dyni_Environment_Instruments",
          "kind": "depth"
        },
        {
          "name": "dyni_Vessel_Instruments",
          "kind": "voltage"
        }
      ]
    },
    "gpspage3": {
      "left": [
        {
          "name": "dyni_Vessel_Instruments",
          "kind": "voltageLinear",
          "weight": 1,
          "voltageLinearMinValue": 10.5,
          "voltageLinearMaxValue": 15.5,
          "voltageLinearTickMajor": 0.5,
          "voltageLinearTickMinor": 0.1,
          "voltageLinearWarningFrom": 12.2,
          "voltageLinearAlarmFrom": 11.8,
          "voltageLinearShowEndLabels": true
        },
        {
          "name": "dyni_Vessel_Instruments",
          "kind": "dateTime"
        }
      ],
      "m1": [
        {
          "kind": "depthLinear",
          "name": "dyni_Environment_Instruments",
          "weight": 1
        },
        {
          "name": "dyni_Nav_Instruments",
          "kind": "positionBoat"
        }
      ],
      "right": [
        {
          "name": "dyni_Environment_Instruments",
          "kind": "temp"
        },
        {
          "name": "dyni_Environment_Instruments",
          "kind": "pressure"
        },
        {
          "name": "dyni_Vessel_Instruments",
          "kind": "alarm"
        }
      ]
    },
    "editroutepage": {
      "left": [
        {
          "name": "dyni_Nav_Instruments",
          "kind": "editRoute",
          "className": "dyniplugin dyni-host-html dyni-hide-native-head",
          "leadingZero": true,
          "caption_editRoutePts": "PTS",
          "caption_editRouteDst": "DST",
          "formatUnit_editRouteDst": "nm",